[
 {
  "if": {
   "key": "n_rows",
   "op": "<",
   "value": 1000
  },
  "then": {
   "field": "model",
   "prefer": "hgb"
  },
  "evidence": 2,
  "counter": 0
 },
 {
  "if": {
   "key": "has_categorical",
   "op": "==",
   "value": 1
  },
  "then": {
   "field": "encode",
   "prefer": "onehot"
  },
  "evidence": 2,
  "counter": 0
 },
 {
  "if": {
   "key": "imbalance",
   "op": "<",
   "value": 0.35
  },
  "then": {
   "field": "class_weight",
   "prefer": "balanced"
  },
  "evidence": 1,
  "counter": 0
 }
]
